publisher,title,url,published_at,raw_source
ABC News (AU),Your shortcut guide to F1 and Oscar Piastri as the championship race heats up,https://www.abc.net.au/news/2025-09-02/your-shortcut-guide-to-f1-oscar-piastri-and-drive-to-survive/105581626,2025-09-02T01:59:01Z,newsapi
GlobeNewswire,"KBR Investor News: If You Have Suffered Losses in KBR, Inc. (NYSE: KBR), You Are Encouraged to Contact The Rosen Law Firm About Your Rights",https://www.globenewswire.com/news-release/2025/09/02/3142303/673/en/KBR-Investor-News-If-You-Have-Suffered-Losses-in-KBR-Inc-NYSE-KBR-You-Are-Encouraged-to-Contact-The-Rosen-Law-Firm-About-Your-Rights.html,2025-09-02T01:58:00Z,newsapi
The Hockey News,Blues Soaring Forward Has 40-Goal Potential,https://thehockeynews.com/nhl/st-louis-blues/latest-news/blues-soaring-forward-has-40-goal-potential,2025-09-02T01:57:50Z,newsapi
Memeorandum.com,"Exclusive: ICE reactivated its $2 million contract with Israeli spyware firm Paragon, following its acquisition by U.S. capital (Jack Poulson/All-Source Intelligence)",https://www.memeorandum.com/250901/p79,2025-09-02T01:55:00Z,newsapi
Yahoo Entertainment,"Kim Jong Un Crosses Into China by Train to Meet Xi, Putin",https://finance.yahoo.com/news/kim-jong-un-crosses-china-015450609.html,2025-09-02T01:54:50Z,newsapi
Biztoc.com,Asia Morning Briefing: Hex Trust CEO Sees Both Promise and Peril in Bitcoin Treasury Firms,https://biztoc.com/x/1ca2f1f1f2636483,2025-09-02T01:54:41Z,newsapi
Biztoc.com,North Korea's Kim Arrives in China for Military Parade,https://biztoc.com/x/8f310dc54b7c71f4,2025-09-02T01:54:40Z,newsapi
Slashdot.org,Democratic Rep. Jerry Nadler to retire from Congress - NBC News,https://slashdot.org/firehose.pl?op=view&amp;id=178971282,2025-09-02T01:52:58Z,newsapi
Slashdot.org,Trump says he's awarding former New York Mayor Rudy Giuliani the Presidential Medal of Freedom - AP News,https://slashdot.org/firehose.pl?op=view&amp;id=178971280,2025-09-02T01:52:48Z,newsapi
Slashdot.org,"Graham Greene, Echo and Defiance Actor, Dead at 73 - TVLine",https://slashdot.org/firehose.pl?op=view&amp;id=178971274,2025-09-02T01:52:27Z,newsapi
Slashdot.org,Woody Allen Says Donald Trump Was 'A Pleasure' to Direct in 'Celebrity' - TMZ,https://slashdot.org/firehose.pl?op=view&amp;id=178971268,2025-09-02T01:52:17Z,newsapi
Paul Tan's Automotive News,"Honda Malaysia Sept 2025 promo – CR-V up to RM15k off, City RM8k off, free service for existing customers",https://paultan.org/2025/09/02/honda-malaysia-sept-2025-promo-cr-v-up-to-rm15k-off-city-rm8k-off-free-service-for-existing-customers/,2025-09-02T01:50:51Z,newsapi
Memeorandum.com,EXCLUSIVE: Full Transcript: Daily Caller Interviews President Donald Trump (Reagan Reese/The Daily Caller),https://www.memeorandum.com/250901/p78,2025-09-02T01:50:00Z,newsapi
Boxingnews24.com,Bill Haney Fires Back at Eddie Hearn’s Claim That Devin Haney Is Just Chasing a Payday,https://www.boxingnews24.com/2025/09/bill-haney-fires-back-at-eddie-hearns-claim-that-devin-haney-is-just-chasing-a-payday/,2025-09-02T01:49:32Z,newsapi
Newsweek,North Korea's Kim Arrives in China for Military Parade,https://www.newsweek.com/kim-north-korea-arrives-china-parade-2122926,2025-09-02T01:47:05Z,newsapi
A Sea Of Blue,Caleb Holt to visit Kentucky Basketball this weekend,https://www.aseaofblue.com/kentucky-wildcats-basketball/146489/caleb-holt-visit-uk,2025-09-02T01:45:24Z,newsapi
Mypeoplesreview.com,Nepali officials reject Nepal joining China’s GSI,https://mypeoplesreview.com/2025/09/02/nepali-officials-reject-nepal-joining-chinas-gsi/,2025-09-02T01:45:00Z,newsapi
The Times of India,BigBasket top brass churn; RMG ban pain manifests,https://economictimes.indiatimes.com/tech/newsletters/morning-dispatch/bigbasket-top-brass-churn-rmg-ban-pain-manifests/articleshow/123644854.cms,2025-09-02T01:44:33Z,newsapi
International Business Times,North Korea's Kim In China Ahead Of Massive Military Parade,https://www.ibtimes.com/north-koreas-kim-china-ahead-massive-military-parade-3782171,2025-09-02T01:42:23Z,newsapi
Yahoo Entertainment,25 in 2025: Seahawks' Legion of Boom was an NFL phenomenon that's been imitated for years but never matched,https://sports.yahoo.com/nfl/article/25-in-2025-seahawks-legion-of-boom-was-an-nfl-phenomenon-thats-been-imitated-for-years-but-never-matched-014143229.html,2025-09-02T01:41:43Z,newsapi
Al Jazeera English,Belgium to recognise Palestine at UN General Assembly: Foreign minister,https://www.aljazeera.com/news/2025/9/2/belgium-to-recognise-palestine-at-un-general-assembly-foreign-minister,2025-09-02T01:40:39Z,newsapi
Memeorandum.com,Leaked 'Gaza Riviera' plan dismissed as 'insane' attempt to cover ethnic cleansing (The Guardian),https://www.memeorandum.com/250901/p77,2025-09-02T01:40:00Z,newsapi
Financial Post,"Crypto’s US Momentum, Trump Ties Steal Show at Hong Kong Event",https://financialpost.com/pmn/business-pmn/cryptos-us-momentum-trump-ties-steal-show-at-hong-kong-event,2025-09-02T01:39:38Z,newsapi
Thefly.com,Fly Intel: Top five weekend stock stories,https://thefly.com/permalinks/entry.php/id4191029/NSRGY;SSNLF;HXSCL;AMZN;MRK;INTC-Fly-Intel-Top-five-weekend-stock-stories,2025-09-02T01:38:59Z,newsapi
ABC News (AU),SA MP Troy Bell resigns from parliament after failed appeal for fraud and theft offences,https://www.abc.net.au/news/2025-09-02/mount-gambier-mp-troy-bell-resigns-from-parliament/105723822,2025-09-02T01:38:24Z,newsapi
Digital Journal,North Korea’s Kim in China ahead of massive military parade,https://www.digitaljournal.com/world/north-koreas-kim-in-china-ahead-of-massive-military-parade/article,2025-09-02T01:37:21Z,newsapi
Nep123.com, Sunrise Holdings IPO Launch!  Get Ready for a HUGE 24 Crore Offering! ✨,https://nep123.com/sunrise-holdings-ipo-launch-get-ready-for-a-huge-24-crore-offering/,2025-09-02T01:34:43Z,newsapi
Breitbart News,18 Illegal Aliens Arrested in Texas Marijuana Warehouse,https://www.breitbart.com/border/2025/09/01/18-illegal-aliens-arrested-in-texas-marijuana-warehouse/,2025-09-02T01:33:13Z,newsapi
Slashdot.org,"11-year-old boy shot and killed while playing ""ding dong ditch"" doorbell prank in Houston - CBS News",https://slashdot.org/firehose.pl?op=view&amp;id=178971072,2025-09-02T01:32:31Z,newsapi
Thepinknews.com,Chloë Grace Moretz reveals ‘non-traditional’ blue wedding dress for marriage to Kate Harrison,https://www.thepinknews.com/2025/09/02/chloe-grace-moretz-blue-wedding-dress-kate-harrison/,2025-09-02T01:32:30Z,newsapi
ABC News (AU),Queensland premier referred to state's corruption watchdog,https://www.abc.net.au/news/2025-09-02/david-crisafulli-crime-and-corruption-referral-health-officer/105723510,2025-09-02T01:32:21Z,newsapi
Slashdot.org,"Powerball jackpot reaches $1.1 billion for Labor Day drawing, 5th largest in history - ABC News",https://slashdot.org/firehose.pl?op=view&amp;id=178971054,2025-09-02T01:32:11Z,newsapi
Freerepublic.com,‘Trump has effectively banned Indians’: H-1B techies react to new wage-based system,https://freerepublic.com/focus/f-news/4338137/posts,2025-09-02T01:31:51Z,newsapi
Freerepublic.com,The Left Glories in Insulting and Suppressing Ordinary Americans,https://freerepublic.com/focus/f-bloggers/4338136/posts,2025-09-02T01:31:00Z,newsapi
USA Today,"Puerto Rico Lottery results: See winning numbers for Pega 2, Pega 3 on Sept. 1, 2025",https://www.usatoday.com/story/money/lottery/2025/09/01/puerto-rico-lottery-results-winning-numbers/85932784007/,2025-09-02T01:30:23Z,newsapi
Livemint,Mint Quick Edit | PMI cheer: Indian factories are in high gear,https://www.livemint.com/opinion/online-views/india-gdp-growth-manufacturing-pmi-hsbc-factories-china-manufacturing-slowdown-us-tariffs-beijing-exports-demand-us-grow-11756734625378.html,2025-09-02T01:30:17Z,newsapi
The Daily Dot,“Sorry they got caught”: Roblox to launch adults-only section after mounting pressure from parents,https://www.dailydot.com/culture/roblox-adults-only-section-safety/,2025-09-02T01:30:17Z,newsapi
Snopes.com,"Yes, the CIA ran a brothel in San Francisco and tested LSD on unsuspecting patrons",https://www.snopes.com//fact-check/cia-brothel-san-francisco-lsd/,2025-09-02T01:30:00Z,newsapi
Thefly.com,"Starbucks CEO says fall lineup drove 'record-breaking' week, Bloomberg says",https://thefly.com/permalinks/entry.php/id4191028/SBUX-Starbucks-CEO-says-fall-lineup-drove-recordbreaking-week-Bloomberg-says,2025-09-02T01:29:41Z,newsapi
Fox News,"Minivan plows through crowd at Pennsylvania festival, injuring three people",https://www.foxnews.com/us/minivan-plows-through-crowd-pennsylvania-festival-injuring-three-people,2025-09-02T01:28:14Z,newsapi
Freerepublic.com,Poodle who helped first responders during Los Angeles wildfires nominated for national award,https://freerepublic.com/focus/f-chat/4338135/posts,2025-09-02T01:26:51Z,newsapi
Freerepublic.com,Only a really big jobs report might stop the Fed from cutting interest rates. Don’t count on it.,https://freerepublic.com/focus/f-news/4338134/posts,2025-09-02T01:26:47Z,newsapi
The Times of India,"""All options on table"" for sanctions: US Treasury Secy after Russia's massive attacks on Ukraine",https://economictimes.indiatimes.com/news/international/global-trends/all-options-on-table-for-sanctions-us-treasury-secy-after-russias-massive-attacks-on-ukraine/articleshow/123644965.cms,2025-09-02T01:24:12Z,newsapi
Thefly.com,Zai Lab announces approval of TIVDAK in Hong Kong,https://thefly.com/permalinks/entry.php/id4191027/ZLAB-Zai-Lab-announces-approval-of-TIVDAK-in-Hong-Kong,2025-09-02T01:23:44Z,newsapi
WPXI Pittsburgh,"1.2 million immigrants are gone from the US labor force under Trump, preliminary data shows",https://www.wpxi.com/news/local/12-million-immigrants-are-gone-us-labor-force-under-trump-preliminary-data-shows/YG7JYUFRQ5CMJH75ITHTHBU4L4/,2025-09-02T01:23:15Z,newsapi
Thefly.com,Apollo Global names Yasuo Kashiwagi as Head of Japan,https://thefly.com/permalinks/entry.php/id4191026/APO-Apollo-Global-names-Yasuo-Kashiwagi-as-Head-of-Japan,2025-09-02T01:22:50Z,newsapi
Thefly.com,Amazon.com launches infrastructure region in New Zealand,https://thefly.com/permalinks/entry.php/id4191025/AMZN-Amazoncom-launches-infrastructure-region-in-New-Zealand,2025-09-02T01:22:06Z,newsapi
Mypeoplesreview.com,"PM Oli meets Russian President Vladimir Putin in Tinjian, China",https://mypeoplesreview.com/2025/09/02/pm-oli-meets-russian-president-vladimir-putin-in-tinjian-china/,2025-09-02T01:20:45Z,newsapi
NBC News,3 injured when minivan hits festivalgoers at Pennsylvania celebration,https://www.nbcnews.com/news/us-news/3-injured-minivan-hits-festivalgoers-pennsylvania-celebration-rcna228453,2025-09-02T01:19:33Z,newsapi
7NEWS.com.au,Sickie stats revealed: States and industries where Aussies took the most winter sick days,https://7news.com.au/news/sickie-stats-revealed-states-and-industries-where-aussies-took-the-most-winter-sick-days-c-19881710,2025-09-02T01:17:37Z,newsapi
