publisher,title,url,published_at,raw_source
Rockmnation.com,SBN Reacts: Which Offensive Lineman Needs to Improve the Most in Week 2?,https://www.rockmnation.com/missouri-tigers-football/120869/sbn-reacts-which-offensive-lineman-needs-to-improve-the-most-in-week-2,2025-09-03T01:59:45Z,newsapi
Thefly.com,Mineralys Therapeutics 9.8M share Spot Secondary priced at $25.50,https://thefly.com/permalinks/entry.php/id4191851/MLYS-Mineralys-Therapeutics-M-share-Spot-Secondary-priced-at-,2025-09-03T01:58:38Z,newsapi
ABC News,Gov. Tim Walz to call special session on gun laws after Minneapolis school shooting,https://abcnews.go.com/US/wireStory/gov-tim-walz-call-special-session-gun-laws-125188535,2025-09-03T01:58:25Z,newsapi
Marca,Did Angel Reese say she has 3 billion fans? The truth behind the viral quote about American Eagle and Sydney Sweeney,https://www.marca.com/en/basketball/wnba/chicago-sky/2025/09/03/68b79d0122601d14778b45a7.html,2025-09-03T01:55:24Z,newsapi
Memeorandum.com,Appeals court blocks Trump from firing FTC commissioner (Rebecca Falconer/Axios),https://www.memeorandum.com/250902/p135,2025-09-03T01:55:01Z,newsapi
CNBC,Australia's GDP expands more than expected; fastest pace since September 2023,https://www.cnbc.com/2025/09/03/australias-gdp-expands-more-than-expected-fastest-pace-since-september-2023.html,2025-09-03T01:54:48Z,newsapi
Fox News,Kim Jong Un's young daughter being groomed to lead regime after military parade visit in China: expert,https://www.foxnews.com/world/kim-jong-uns-young-daughter-being-groomed-lead-regime-military-parade-visit-china-expert,2025-09-03T01:54:28Z,newsapi
Biztoc.com,Asia Morning Briefing: Are Stablecoins an 'Engine of Global Dollar Demand' or a 2008-Style 'Liquidity Crunch'?,https://biztoc.com/x/570a2cb27f782337,2025-09-03T01:53:52Z,newsapi
Paul Tan's Automotive News,2026 BMW iX3 to debut on September 5 – second-gen EV SUV leads Neue Klasse era; up to 800 km range,https://paultan.org/2025/09/03/2026-bmw-ix3-to-debut-on-september-5/,2025-09-03T01:52:45Z,newsapi
Slashdot.org,"US conducts ‘kinetic strike’ against drug boat from Venezuela, killing 11, Trump says - The Guardian",https://slashdot.org/firehose.pl?op=view&amp;id=178985996,2025-09-03T01:52:20Z,newsapi
CNA,"After buzz cut made the headlines, Alcaraz's game turning heads in New York",https://www.channelnewsasia.com/sport/after-buzz-cut-made-headlines-alcarazs-game-turning-heads-new-york-5329806,2025-09-03T01:51:51Z,newsapi
CinemaBlend,"Law And Order: SVU’s Ice-T Is All For Benson And Stabler Hooking Up, But He Also Has A Blunt Message For Fans Who Keep Asking About It",https://www.cinemablend.com/television/law-and-order-svu-ice-t-benson-stabler-hooking-up-blunt-message-for-fans,2025-09-03T01:50:54Z,newsapi
New Atlas,Flex multitool doubles its modularity with blades galore,https://newatlas.com/knives-multitools/roxon-flex-shears-multi-multitool/,2025-09-03T01:50:52Z,newsapi
Freerepublic.com,Wife of Trump Supporter Faces Deportation After 37 Years in U.S.,https://freerepublic.com/focus/f-news/4338300/posts,2025-09-03T01:50:30Z,newsapi
Space Daily,NorthBase strengthens Infostellar StellarStation network with Finnish site,https://www.spacedaily.com/reports/NorthBase_strengthens_Infostellar_StellarStation_network_with_new_Finnish_site_999.html,2025-09-03T01:49:47Z,newsapi
Space Daily,Doom plays in orbit as Intuition-1 satellite proves versatility of Polish tech,https://www.spacedaily.com/reports/Doom_plays_in_orbit_as_Intuition_1_satellite_proves_versatility_of_Polish_tech_999.html,2025-09-03T01:49:47Z,newsapi
Space Daily,Pixxel expands Firefly fleet advancing global hyperspectral satellite imaging,https://www.spacedaily.com/reports/Pixxel_expands_Firefly_satellite_fleet_with_SpaceX_launch_advancing_global_hyperspectral_Earth_imaging_999.html,2025-09-03T01:49:47Z,newsapi
Space Daily,SwRI advances laser driven testing for ballistic resistance,https://www.spacedaily.com/reports/SwRI_advances_laser_driven_testing_for_ballistic_resistance_999.html,2025-09-03T01:49:47Z,newsapi
Space Daily,New study links satellite discharges to electron buildup in orbit,https://www.spacedaily.com/reports/New_study_links_satellite_discharges_to_electron_buildup_in_orbit_999.html,2025-09-03T01:49:47Z,newsapi
Space Daily,Advancing Single-Photon Sensing Image Sensors to Enable the Search for Life Beyond Earth,https://www.spacedaily.com/reports/Advancing_Single_Photon_Sensing_Image_Sensors_to_Enable_the_Search_for_Life_Beyond_Earth_999.html,2025-09-03T01:49:47Z,newsapi
Space Daily,Ground vibration test validates structural models for UpLift research aircraft,https://www.spacedaily.com/reports/Ground_vibration_test_validates_structural_models_for_UpLift_research_aircraft_999.html,2025-09-03T01:49:47Z,newsapi
Space Daily,Loft Federal wins NASA task order for fault tolerant RISC V flight computer,https://www.spacedaily.com/reports/Loft_Federal_wins_NASA_task_order_for_fault_tolerant_RISC_V_flight_computer_mission_999.html,2025-09-03T01:49:47Z,newsapi
Newsweek,Chargers Rookie Projected to Have Under-the-Radar Breakout Season,https://www.newsweek.com/sports/nfl/chargers-rookie-projected-have-under-radar-breakout-season-2123526,2025-09-03T01:49:30Z,newsapi
Sky.com,Xi hails 'great regeneration of China' with dramatic show of military might,https://news.sky.com/story/president-xi-hails-great-regeneration-of-china-with-dramatic-show-of-military-power-13424044,2025-09-03T01:49:00Z,newsapi
Paul Tan's Automotive News,"DBKL begins trial closure of right turn from Jalan Kerinchi to ease evening traffic – 5pm-7pm, weekdays",https://paultan.org/2025/09/03/dbkl-begins-trial-closure-of-right-turn-from-jalan-kerinchi-to-ease-evening-traffic-5pm-7pm-weekdays/,2025-09-03T01:48:37Z,newsapi
The Times of India,How Xi Jinping just redrew world's geopolitical map,https://economictimes.indiatimes.com/news/international/world-news/how-xi-jinping-just-redrew-worlds-geopolitical-map/articleshow/123667385.cms,2025-09-03T01:48:33Z,newsapi
Dawg Sports,The SEC in a Sentence: Known Unknowns Edition,https://www.dawgsports.com/sec-football/35024/the-sec-in-a-sentence-known-unknowns-edition,2025-09-03T01:48:26Z,newsapi
CBS News,9/2: CBS Evening News,https://www.cbsnews.com/video/090225-cbs-evening-news/,2025-09-03T01:48:23Z,newsapi
The Daily Caller,‘Inappropriate Videos’: FTC’s Chris Mufarrige Explains Disney’s $10M Settlement Over ‘Collecting’ Kids’ Data,https://dailycaller.com/2025/09/02/federal-trade-commission-consumer-protection-disney-settlement-kids-data/,2025-09-03T01:45:41Z,newsapi
Yahoo Entertainment,Inconsistency plagues Dodgers again in loss to Pirates,https://sports.yahoo.com/article/inconsistency-plagues-dodgers-again-loss-014403461.html,2025-09-03T01:44:03Z,newsapi
GlobeNewswire,"C3.AI SHAREHOLDER ALERT BY FORMER LOUISIANA ATTORNEY GENERAL: KAHN SWICK & FOTI, LLC REMINDS INVESTORS WITH LOSSES IN EXCESS OF $100,000 of Lead Plaintiff Deadline in Class Action Lawsuit Against C3.ai, Inc. - AI",https://www.globenewswire.com/news-release/2025/09/03/3143255/6713/en/C3-AI-SHAREHOLDER-ALERT-BY-FORMER-LOUISIANA-ATTORNEY-GENERAL-KAHN-SWICK-FOTI-LLC-REMINDS-INVESTORS-WITH-LOSSES-IN-EXCESS-OF-100-000-of-Lead-Plaintiff-Deadline-in-Class-Action-Lawsu.html,2025-09-03T01:44:00Z,newsapi
Biztoc.com,Chinese Bonds Dogged by Low Yields May Keep Losing Out to Stocks,https://biztoc.com/x/441bed7a9cb30132,2025-09-03T01:42:49Z,newsapi
Biztoc.com,Marilyn Monroe’s Last Home Survives in LA Fight Over Demolition,https://biztoc.com/x/6478163459beb107,2025-09-03T01:42:46Z,newsapi
The Denver Post,Keeler: Will CU Buffs QB Julian Lewis be Deion Sanders’ Arch Manning? The ‘Ju Ju’ Era arrives Saturday,https://www.denverpost.com/2025/09/02/deion-sanders-julian-lewis-cu-buffs-qb-debut/,2025-09-03T01:42:43Z,newsapi
Biztoc.com,"Tyson Foods Names Cole COO, Signals Further Leadership Changes",https://biztoc.com/x/f5db39c11b08c6f1,2025-09-03T01:42:40Z,newsapi
Crikey,"Labor, the Coalition, the media — there’s plenty of blame to go around on migration. But it’s the right trying to normalise hate",http://www.crikey.com.au/2025/09/03/migration-labor-coalition-media-right-wing-extremism/,2025-09-03T01:42:39Z,newsapi
KOLD,Trump addresses health rumors after days without public events,https://www.kold.com/2025/09/02/trump-addresses-health-rumors-after-days-without-public-events/,2025-09-03T01:41:17Z,newsapi
Balloon-juice.com,"War for Ukraine Day 1,286: The Small Hours Are, Once Again, the Deadliest Hours",https://balloon-juice.com/2025/09/02/war-for-ukraine-day-1286-the-small-hours-are-once-again-the-deadliest-hours/,2025-09-03T01:41:05Z,newsapi
Rpnradio.com,Bacolod: Bacolod SP to create additional legislative staff posts,https://rpnradio.com/bacolod-bacolod-sp-to-create-additional-legislative-staff-posts/,2025-09-03T01:40:49Z,newsapi
Prtimes.jp,『Path of Exile 2』が東京ゲームショウ2025に出展決定！ ボスラッシュチャレンジに挑戦し、自らの限界を超えろ！,https://prtimes.jp/main/html/rd/p/000000110.000120153.html,2025-09-03T01:40:02Z,newsapi
GlobeNewswire,"NEOGEN SHAREHOLDER ALERT BY FORMER LOUISIANA ATTORNEY GENERAL: KAHN SWICK & FOTI, LLC REMINDS INVESTORS WITH LOSSES IN EXCESS OF $100,000 of Lead Plaintiff Deadline in Class Action Lawsuit Against Neogen Corporation - NEOG",https://www.globenewswire.com/news-release/2025/09/03/3143253/6713/en/NEOGEN-SHAREHOLDER-ALERT-BY-FORMER-LOUISIANA-ATTORNEY-GENERAL-KAHN-SWICK-FOTI-LLC-REMINDS-INVESTORS-WITH-LOSSES-IN-EXCESS-OF-100-000-of-Lead-Plaintiff-Deadline-in-Class-Action-Laws.html,2025-09-03T01:37:00Z,newsapi
Paul Tan's Automotive News,JPJ eBid: JYJ and QRW number plates up for bidding,https://paultan.org/2025/09/03/jpj-ebid-jyj-and-qrw-number-plates-up-for-bidding/,2025-09-03T01:37:00Z,newsapi
GlobeNewswire,"DOW SHAREHOLDER ALERT BY FORMER LOUISIANA ATTORNEY GENERAL: KAHN SWICK & FOTI, LLC REMINDS INVESTORS WITH LOSSES IN EXCESS OF $100,000 of Lead Plaintiff Deadline in Class Action Lawsuit Against Dow Inc. - DOW",https://www.globenewswire.com/news-release/2025/09/03/3143252/6713/en/DOW-SHAREHOLDER-ALERT-BY-FORMER-LOUISIANA-ATTORNEY-GENERAL-KAHN-SWICK-FOTI-LLC-REMINDS-INVESTORS-WITH-LOSSES-IN-EXCESS-OF-100-000-of-Lead-Plaintiff-Deadline-in-Class-Action-Lawsuit.html,2025-09-03T01:33:00Z,newsapi
9to5Toys,LEGO SEGA Genesis Controller officially revealed with micro-scale Green Hill Zone Sonic scene,http://9to5toys.com/2025/09/02/lego-sega-genesis-controller-revealed/,2025-09-03T01:32:50Z,newsapi
The Conversation Africa,Not all processed foods are bad for you. Here’s what you can tell from reading the label,https://theconversation.com/not-all-processed-foods-are-bad-for-you-heres-what-you-can-tell-from-reading-the-label-260818,2025-09-03T01:32:34Z,newsapi
Hacker News,Python has had async for 10 years – why isn't it more popular? | Hacker News,https://news.ycombinator.com/item?id=45106189,2025-09-03T01:32:34Z,newsapi
Slashdot.org,Trump says he will deploy National Guard to Chicago but doesn't say when - ABC News,https://slashdot.org/firehose.pl?op=view&amp;id=178985838,2025-09-03T01:32:33Z,newsapi
Biztoc.com,Appeals court rejects Trump’s bid to fire Biden-appointed FTC member,https://biztoc.com/x/66ac3332cb3af399,2025-09-03T01:31:54Z,newsapi
Freerepublic.com,"FAFO, ICE STYLE",https://freerepublic.com/focus/f-bloggers/4338298/posts,2025-09-03T01:31:45Z,newsapi
New York Post,"Elon Musk’s transgender daughter Vivian claims she’s broke, lives with 3 roommates after spurning world’s richest dad",https://nypost.com/2025/09/02/us-news/elon-musks-trans-daughter-vivian-wilson-claims-she-not-rich-lives-with-3-roommates/,2025-09-03T01:30:37Z,newsapi
